Sno,index,network,title,imdb,engagement,format,monster_gender,motive
0,1,CBS,What a Night for a Knight,8.1,556.0,TV Series,Male,Theft
1,2,CBS,A Clue for Scooby Doo,8.1,479.0,TV Series,Male,Theft
2,3,CBS,Hassle in the Castle,8.0,455.0,TV Series,Male,Treasure
3,4,CBS,Mine Your Own Business,7.8,426.0,TV Series,Male,Natural Resource
4,5,CBS,Decoy for a Dognapper,7.5,391.0,TV Series,Female,Competition
5,6,CBS,What the Hex Going On?,8.4,384.0,TV Series,Male,Extortion
6,7,CBS,Never Ape an Ape Man,7.6,358.0,TV Series,Male,Competition
7,8,CBS,Foul Play in Funland,8.2,358.0,TV Series,Male,Safety
8,9,CBS,The Backstage Rage,8.1,371.0,TV Series,Male,Counterfeit
9,10,CBS,Bedlam in the Big Top,8.0,346.0,TV Series,Male,Competition
10,11,CBS,A Gaggle of Galloping Ghosts,8.5,379.0,TV Series,Male,Treasure
11,12,CBS,"Scooby-Doo and a Mummy, Too",8.2,358.0,TV Series,Male,Theft
12,14,CBS,Go Away Ghost Ship,8.1,331.0,TV Series,Male,Theft
13,15,CBS,Spooky Space Kook,8.4,372.0,TV Series,Male,Competition
14,16,CBS,A Night of Fright Is No Delight,8.7,403.0,TV Series,Male,Inheritance
15,17,CBS,That's Snow Ghost,8.0,328.0,TV Series,Male,Theft
16,18,CBS,Nowhere to Hyde,8.3,322.0,TV Series,Male,Theft
17,19,CBS,Mystery Mask Mix-Up,7.8,312.0,TV Series,Male,Smuggling
18,20,CBS,Scooby's Night with a Frozen Fright,7.7,301.0,TV Series,Male,Theft
19,21,CBS,"Jeepers, It's the Creeper",8.5,347.0,TV Series,Male,Theft
20,22,CBS,Haunted House Hang-Up,8.4,303.0,TV Series,Male,Treasure
21,24,CBS,Who's Afraid of the Big Bad Werewolf?,8.2,292.0,TV Series,Male,Smuggling
22,25,CBS,Don't Fool with a Phantom,7.9,282.0,TV Series,Male,Theft
23,27,CBS,The Dynamic Scooby-Doo Affair,7.8,232.0,TV Series,Male,Counterfeit
24,28,CBS,Wednesday Is Missing,7.9,119.0,TV Series,Female,Safety
25,29,CBS,The Frickert Fracas,7.9,116.0,TV Series,Male,Treasure
26,30,CBS,Guess Who's Knott Coming to Dinner?,7.9,111.0,TV Series,Male,Inheritance
27,31,CBS,A Good Medium Is Rare,7.7,88.0,TV Series,Male,Theft
28,32,CBS,Sandy Duncan's Jekyll and Hyde,7.8,90.0,TV Series,Male,Preservation
29,33,CBS,The Secret of Shark Island,8.5,109.0,TV Series,Male,Treasure
30,35,CBS,The Ghost of Bigfoot,8.3,118.0,TV Series,Male,Theft
31,36,CBS,The Ghost of the Red Baron,7.6,86.0,TV Series,Male,Competition
32,37,CBS,The Ghostly Creep from the Deep,7.4,90.0,TV Series,Male,Natural Resource
33,38,CBS,The Haunted Horseman of Hagglethorn Hall,7.8,86.0,TV Series,Male,Competition
34,39,CBS,The Phantom of the Country Music Hall,7.6,81.0,TV Series,Male,Theft
35,40,CBS,The Caped Crusader Caper,7.2,183.0,TV Series,Male,Theft
36,41,CBS,The Lochness Mess,7.9,114.0,TV Series,Male,Treasure
37,42,CBS,The Mystery of Haunted Island,7.4,103.0,TV Series,Male,Competition
38,43,CBS,The Haunted Showboat,7.9,82.0,TV Series,Male,Counterfeit
39,44,CBS,Mystery in Persia,7.5,82.0,TV Series,Male,Competition
40,45,CBS,The Spirited Spooked Sports Show,7.4,73.0,TV Series,Male,Competition
41,46,CBS,The Exterminator,7.6,85.0,TV Series,Male,Competition
42,47,CBS,The Weird Winds of Winona,7.3,91.0,TV Series,Male,Competition
43,48,CBS,The Haunted Candy Factory,7.8,104.0,TV Series,Male,Smuggling
44,49,CBS,The Haunted Carnival,7.6,92.0,TV Series,Male,Competition
45,51,ABC,Everyone Hyde!,7.2,12.0,Crossover,Male,Theft
46,52,ABC,The Fiesta Host is an Aztec Ghost,7.4,97.0,TV Series,Male,Treasure
47,53,ABC,"What Now, Lowbrow?",6.9,11.0,Crossover,Male,Theft
48,54,ABC,The Gruesome Game of the Gator Ghoul,7.5,95.0,TV Series,Male,Competition
49,55,ABC,Whatta Shocking Ghost,8.0,101.0,TV Series,Male,Competition
50,56,ABC,The Headless Horseman of Halloween,8.0,127.0,TV Series,Male,Theft
51,57,ABC,Scared a Lot in Camelot,7.6,93.0,TV Series,Male,Theft
52,58,ABC,The Harum-Scarum Sanitarium,8.2,99.0,TV Series,Male,Smuggling
53,59,ABC,The No-Face Zombie Chase Case,7.7,91.0,TV Series,Male,Theft
54,61,ABC,A Frightened Hound Meets Demons Underground,7.4,84.0,TV Series,Male,Theft
55,62,ABC,The Wizard of Ooze,6.3,7.0,Crossover,Male,Theft
56,63,ABC,A Bum Steer for Scooby,6.8,84.0,TV Series,Male,Theft
57,64,ABC,There's a Demon Shark in the Foggy Dark,7.2,80.0,TV Series,Male,Smuggling
58,65,ABC,"Scooby-Doo, Where's the Crew?",7.3,77.0,TV Series,Male,Treasure
59,66,ABC,The Ghost That Sacked the Quarterback,6.8,75.0,TV Series,Male,Competition
60,67,ABC,The Ghost of the Bad Humor Man,7.7,84.0,TV Series,Male,Theft
61,68,ABC,The Spirits of '76,7.5,81.0,TV Series,Male,Counterfeit
62,69,ABC,The Curse of the Viking Lake,7.4,71.0,TV Series,Male,Natural Resource
63,72,ABC,Vampire Bats and Scaredy Cats,8.2,104.0,TV Series,Male,Competition
64,75,ABC,"Hang in There, Scooby-Doo",7.4,76.0,TV Series,Male,Theft
65,78,ABC,The Chiller Diller Movie Thriller,7.9,77.0,TV Series,Male,Competition
67,81,ABC,The Spooky Case of the Grand Prix Race,7.4,75.0,TV Series,Male,Theft
68,87,ABC,Creepy Cruise,7.7,78.0,TV Series,Male,Theft
69,90,ABC,The Creepy Heap from the Deep,7.4,71.0,TV Series,Male,Smuggling
72,109,ABC,Watch Out! The Willawa!,7.5,96.0,TV Series,Male,Smuggling
74,112,ABC,A Creepy Tangle in the Bermuda Triangle,7.3,101.0,TV Series,Male,Theft
75,115,ABC,A Scary Night with a Snow Beast Fright,7.1,98.0,TV Series,Male,Natural Resource
78,118,ABC,To Switch a Witch,8.0,107.0,TV Series,Female,Inheritance
79,121,ABC,The Tar Monster,7.6,92.0,TV Series,Male,Treasure
81,127,ABC,The Creepy Case of Old Iron Face,7.7,80.0,TV Series,Male,Smuggling
82,130,ABC,"Jeepers, It's the Jaguaro!",7.2,91.0,TV Series,Male,Natural Resource
83,133,ABC,Make a Beeline Away from that Feline,8.0,88.0,TV Series,Male,Theft
84,134,ABC,The Creepy Creature of Vulture's Claw,7.5,80.0,TV Series,Male,Natural Resource
85,135,ABC,The Diabolical Disc Demon,7.5,84.0,TV Series,Male,Smuggling
86,136,ABC,Scooby's Chinese Fortune Kooky Caper,7.5,85.0,TV Series,Male,Theft
87,137,ABC,A Menace in Venice,7.5,92.0,TV Series,Male,Treasure
88,138,ABC,Don't Go Near the Fortress of Fear,7.2,83.0,TV Series,Male,Treasure
89,139,ABC,The Warlock of Wimbledon,6.8,84.0,TV Series,Male,Competition
90,140,ABC,The Beast is Awake in Bottomless Lake,7.1,84.0,TV Series,Male,Smuggling
91,141,ABC,The Scarab Lives!,7.6,67.0,TV Series,Male,Competition
92,142,ABC,The Night Ghoul of Wonderworld,7.6,59.0,TV Series,Male,Theft
93,143,ABC,Strange Encounters of a Scooby Kind,7.6,54.0,TV Series,Male,Smuggling
94,144,ABC,The Neon Phantom of the Roller Disco!,7.4,55.0,TV Series,Male,Competition
95,145,ABC,"Shiver and Shake, That Demon's a Snake",7.5,51.0,TV Series,Male,Smuggling
96,146,ABC,The Scary Sky Skeleton,7.4,51.0,TV Series,Male,Natural Resource
97,147,ABC,The Demon of the Dugout,7.5,51.0,TV Series,Male,Theft
98,148,ABC,The Hairy Scare of the Devil Bear,7.3,53.0,TV Series,Male,Treasure
99,149,ABC,Twenty Thousand Screams Under the Sea,7.6,47.0,TV Series,Male,Treasure
100,150,ABC,I Left My Neck in San Francisco,8.0,52.0,TV Series,Female,Theft
101,151,ABC,When You Wish Upon a Star Creature,7.2,48.0,TV Series,Male,Theft
102,152,ABC,"The Ghoul, the Bat and the Ugly",7.7,52.0,TV Series,Male,Theft
103,154,ABC,Rocky Mountain Yiiiii!,7.5,48.0,TV Series,Male,Treasure
104,155,ABC,The Sorcerer's a Menace,7.3,47.0,TV Series,Male,Theft
105,156,ABC,"Lock the Door, It's a Minotaur!",7.5,46.0,TV Series,Male,Treasure
106,158,ABC,A Close Encounter with a Strange Kind,7.1,35.0,TV Series (segmented),Male,Experimentation
107,159,ABC,A Fit Night Out for Bats,7.1,35.0,TV Series (segmented),Male,Food
108,160,ABC,The Chinese Food Factory,7.1,35.0,TV Series (segmented),Male,Theft
109,161,ABC,Scooby's Desert Dilemma,7.2,36.0,TV Series (segmented),Male,Experimentation
110,162,ABC,The Old Cat and Mouse Game,7.2,37.0,TV Series (segmented),Male,Food
111,164,ABC,Mummy's the Word,7.2,36.0,TV Series (segmented),Male,Trespassing
112,168,ABC,Scooby's Fantastic Island,7.1,31.0,TV Series (segmented),Male,Assistance
113,169,ABC,Long John Scrappy,6.8,32.0,TV Series (segmented),Male,Abduction
114,174,ABC,Swamp Witch,6.7,36.0,TV Series (segmented),Female,Food
115,175,ABC,Sir Scooby and the Black Knight,7.0,29.0,TV Series (segmented),Male,Trespassing
116,176,ABC,Waxworld,6.7,36.0,TV Series (segmented),Male,Abduction
117,179,ABC,South Seas Scare,7.0,32.0,TV Series (segmented),Male,Trespassing
118,181,ABC,Alaskan King Coward,7.0,32.0,TV Series (segmented),Male,Food
119,182,ABC,"Et Tu, Scoob?",6.7,29.0,TV Series (segmented),Male,Competition
120,183,ABC,Soggy Bog Scooby,6.7,29.0,TV Series (segmented),Male,Food
121,187,ABC,Moonlight Madness,7.0,32.0,TV Series (segmented),Male,Loneliness
122,189,ABC,Scooby at the Center of the World,7.1,31.0,TV Series (segmented),Male,Trespassing
123,190,ABC,Scooby's Trip to Ahz,7.1,31.0,TV Series (segmented),Female,Imagination
124,191,ABC,A Fright at the Opera,7.2,31.0,TV Series (segmented),Male,Trespassing
125,192,ABC,Robot Ranch,7.1,31.0,TV Series (segmented),Male,Abduction
126,193,ABC,Surprised Spies,7.1,31.0,TV Series (segmented),Male,Theft
127,194,ABC,The Invasion of the Scooby Snatchers,7.2,31.0,TV Series (segmented),Male,Conquer
128,197,ABC,Scooby-Nocchio,7.4,32.0,TV Series (segmented),Male,Imagination
129,198,ABC,Lighthouse Keeper Scooby,7.4,32.0,TV Series (segmented),Male,Trespassing
130,199,ABC,Scooby's Roots,7.4,32.0,TV Series (segmented),Male,Mistake
131,200,ABC,Scooby's Escape from Atlantis,7.2,30.0,TV Series (segmented),Male,Trespassing
132,201,ABC,Excalibur Scooby,7.2,30.0,TV Series (segmented),Male,Assistance
133,202,ABC,Scooby Saves the World,7.1,27.0,TV Series (segmented),Male,Conquer
134,204,ABC,Rickshaw Scooby,7.1,29.0,TV Series (segmented),Male,Trespassing
135,205,ABC,Scooby's Luck of the Irish,7.2,30.0,TV Series (segmented),Male,Trespassing
136,207,ABC,Scooby's House of Mystery,7.1,27.0,TV Series (segmented),Female,Experimentation
137,208,ABC,Sweet Dreams Scooby,7.1,27.0,TV Series (segmented),Male,Imagination
138,209,ABC,Scooby-Doo 2000,7.1,29.0,TV Series (segmented),Male,Automated
139,210,ABC,Punk Rock Scooby,7.1,29.0,TV Series (segmented),Male,Abduction
140,211,ABC,Canine to Five,7.4,27.0,TV Series (segmented),Male,Food
141,212,ABC,Hard Hat Scooby,7.1,27.0,TV Series (segmented),Male,Food
142,213,ABC,Hothouse Scooby,7.1,29.0,TV Series (segmented),Male,Food
143,216,ABC,Tenderbigfoot,7.1,32.0,TV Series (segmented),Male,Theft
144,217,ABC,Scooby and the Beanstalk,7.1,32.0,TV Series (segmented),Male,Food
145,220,ABC,Catfish Burglar Caper,7.1,24.0,TV Series (segmented),Male,Theft
146,230,ABC,Comic Book Caper,7.4,23.0,TV Series (segmented),Male,Theft
147,235,ABC,Scooby-Doo and Genie-Poo,7.1,25.0,TV Series (segmented),Female,Abduction
148,237,ABC,Captain Canine Caper,7.2,23.0,TV Series (segmented),Male,Extortion
149,238,ABC,The Incredible Cat Lady Caper,7.0,23.0,TV Series (segmented),Female,Theft
150,240,ABC,One Million Years Before Lunch,7.1,24.0,TV Series (segmented),Male,Abduction
151,241,ABC,Where's the Wolf,7.4,24.0,TV Series (segmented),Male,Food
152,243,ABC,Snow Job Too Small,6.8,26.0,TV Series (segmented),Male,Inheritance
153,244,ABC,Scooby the Barbarian,7.4,27.0,TV Series (segmented),Male,Theft
154,245,ABC,No Sharking Zone,7.4,27.0,TV Series (segmented),Male,Treasure
155,247,ABC,The Quagmire Quake Caper,7.5,21.0,TV Series (segmented),Male,Theft
156,248,ABC,Hound of the Scoobyvilles,7.5,17.0,TV Series (segmented),Male,Inheritance
157,249,ABC,The Dinosaur Deception,7.5,17.0,TV Series (segmented),Male,Treasure
158,250,ABC,The Creature Came from The Chemlab,7.7,20.0,TV Series (segmented),Male,Theft
159,251,ABC,"No Thanks, Masked Manx",7.7,20.0,TV Series (segmented),Male,Theft
160,252,ABC,Scooby of the Jungle,7.2,18.0,TV Series (segmented),Male,Smuggling
161,254,ABC,Scooby Roo,7.5,15.0,TV Series (segmented),Male,Natural Resource
162,256,ABC,Wizards and Warlocks,7.3,15.0,TV Series (segmented),Male,Competition
163,257,ABC,Scoobsie,7.3,15.0,TV Series (segmented),Male,Competition
164,259,ABC,The Crazy Carnival Caper,7.1,17.0,TV Series (segmented),Male,Theft
165,260,ABC,Scooby and the Minotaur,7.4,18.0,TV Series (segmented),Male,Treasure
166,261,ABC,Scooby Pinch Hits,7.4,18.0,TV Series (segmented),Male,Competition
167,262,ABC,The Fall Dog,7.2,20.0,TV Series (segmented),Male,Competition
168,263,ABC,The Scooby Coupe,7.2,20.0,TV Series (segmented),Male,Competition
169,265,ABC,Scooby ala Mode,6.5,21.0,TV Series (segmented),Male,Competition
170,266,ABC,Where's Scooby-Doo?,6.5,19.0,TV Series,Male,Smuggling
171,267,ABC,Wedding Bell Boos!,6.5,23.0,TV Series,Male,Treasure
172,268,ABC,"Happy Birthday, Scooby-Doo",7.2,45.0,TV Series,Male,Theft
173,269,ABC,Scooby's Peep-Hole Pandemonium,7.2,29.0,TV Series (segmented),Female,Theft
174,270,ABC,The Hand of Horror,7.2,29.0,TV Series (segmented),Male,Theft
175,271,ABC,Scoo-Be or Not Scoo-Be?,7.5,29.0,TV Series (segmented),Male,Natural Resource
176,272,ABC,The Stoney Glare Stare,7.5,29.0,TV Series (segmented),Male,Treasure
177,273,ABC,Mission: Un-Doo-Able,7.0,26.0,TV Series (segmented),Male,Conquer
178,274,ABC,The Bee Team,7.0,26.0,TV Series (segmented),Male,Competition
179,275,ABC,Doom Service,7.1,24.0,TV Series (segmented),Male,Theft
180,277,ABC,Ghost of the Ancient Astronauts,6.9,36.0,TV Series,Male,Treasure
181,278,ABC,The Night of Living Toys,7.2,23.0,TV Series (segmented),Male,Treasure
182,279,ABC,South Pole Vault,7.2,23.0,TV Series (segmented),Male,Competition
183,280,ABC,A Halloween Hassle at Dracula's Castle,8.0,47.0,TV Series,Male,Theft
184,281,ABC,A Night Louse at the White House,7.5,26.0,TV Series,Male,Theft
185,282,ABC,Showboat Scooby,7.3,27.0,TV Series (segmented),Male,Treasure
186,284,ABC,Sherlock Doo,7.6,27.0,TV Series,Male,Theft
187,285,ABC,A Scarey Duel with a Cartoon Ghoul,7.0,24.0,TV Series (segmented),Male,Theft
188,286,ABC,E*I*E*I*O,7.0,24.0,TV Series (segmented),Male,Competition
189,287,ABC,The Nutcracker Scoob,7.9,60.0,TV Series,Male,Treasure
190,289,ABC,Scoobra Kadoobra,7.6,91.0,TV Series,Male,Conquer
191,291,ABC,Reflections in the Ghoulish Eye,7.2,79.0,TV Series,Male,Conquer
192,293,ABC,Ship of Ghouls,7.5,74.0,TV Series,Male,Conquer
193,295,ABC,When You Witch Upon a Star,7.1,78.0,TV Series,Female,Conquer
194,296,ABC,It's a Wonderful Scoob,7.4,77.0,TV Series,Male,Conquer
195,297,ABC,Scooby in Kwacky Land,7.7,76.0,TV Series,Male,Conquer
196,298,ABC,Coast-to-Ghost,7.4,71.0,TV Series,Male,Conquer
197,299,ABC,The Ghouliest Show on Earth,7.4,77.0,TV Series,Male,Conquer
198,300,ABC,Horror-Scope Scoob,7.4,77.0,TV Series,Male,Conquer
199,301,Syndication,Scooby-Doo Meets the Boo Brothers,7.1,3727.0,Movie,Male,Treasure
200,302,ABC,A Bicycle Built for Boo,7.3,68.0,TV Series,Male,Counterfeit
201,303,ABC,The Sludge Monster from the Earth's Core,7.5,58.0,TV Series,Male,Theft
202,304,ABC,The Schnoock Who Took My Comic Book,8.0,55.0,TV Series,Male,Theft
203,305,ABC,Wanted Cheddar Alive,7.5,61.0,TV Series,Male,Competition
204,306,ABC,For Letter or Worse,7.4,44.0,TV Series,Male,Competition
205,307,ABC,The Babysitter from Beyond,7.6,50.0,TV Series,Male,Theft
206,309,ABC,Snow Place Like Home,7.8,44.0,TV Series,Male,Natural Resource
207,310,ABC,"Now Museum, Now You Don't",7.7,47.0,TV Series,Male,Theft
208,311,ABC,Scooby Dude,7.0,47.0,TV Series,Male,Smuggling
209,312,ABC,Ghost Who's Coming to Dinner,7.5,53.0,TV Series,Male,Competition
210,314,ABC,The Story Stick,6.9,46.0,TV Series,Male,Competition
211,315,ABC,Robopup,7.2,44.0,TV Series,Male,Theft
212,316,ABC,Lights...Camera...Monster,7.5,45.0,TV Series,Male,Theft
213,317,ABC,Curse of the Collar,7.7,43.0,TV Series,Male,Theft
214,318,ABC,The Return of Commander Cool,7.7,43.0,TV Series,Male,Theft
215,319,ABC,The Spirit of Rock'n Roll,7.8,43.0,TV Series,Male,Theft
216,320,ABC,Chickenstein Lives,7.5,38.0,TV Series,Male,Smuggling
217,321,ABC,Night of the Living Burger,7.6,42.0,TV Series,Male,Competition
218,322,ABC,The Computer Walks Among Us,7.7,40.0,TV Series,Male,Competition
219,324,ABC,"Terror, Thy Name is Zombo",7.8,38.0,TV Series,Male,Competition
220,325,ABC,Night of the Boogey Biker,7.1,37.0,TV Series (segmented),Male,Assistance
221,326,ABC,Dawn of the Spooky Shuttle Scare,7.1,37.0,TV Series (segmented),Male,Competition
222,327,ABC,Horror of the Haunted Hairpiece,6.9,35.0,TV Series,Male,Competition
223,328,ABC,Wrestle Maniacs,7.2,38.0,TV Series,Male,Competition
224,329,ABC,The Were-Doo of Doo Manor,7.2,40.0,TV Series,Male,Treasure
225,331,ABC,The Ghost of Mrs. Shusham,6.6,37.0,TV Series (segmented),Female,Theft
226,333,ABC,Mayhem of the Moving Mollusk,7.2,32.0,TV Series,Male,Competition
227,335,Cartoon Network,Bravo Dooby-Doo,8.4,148.0,Crossover,Male,Trespassing
228,338,Cartoon Network,The Scooby-Doo Project,7.4,390.0,TV Series,Male,Entertainment
229,339,Warner Home Video,Scooby-Doo and the Alien Invaders,6.9,5625.0,Movie,Male,Natural Resource
230,340,Warner Home Video,Scooby-Doo and the Cyber Chase,7.0,6632.0,Movie,Male,Competition
231,341,Cartoon Network,Night of the Living Doo,7.2,256.0,TV Series,Male,Competition
232,343,Adult Swim,Shaggy Busted,8.1,133.0,Crossover,Male,Competition
233,344,The WB,There's No Creature Like Snow Creature,7.5,176.0,TV Series,Male,Competition
234,345,The WB,3-D Struction,7.4,150.0,TV Series,Male,Natural Resource
235,346,The WB,Space Ape and the Cape,7.6,151.0,TV Series,Male,Competition
236,347,The WB,Big Scare in the Big Easy,7.7,142.0,TV Series,Male,Competition
237,348,The WB,"It's Mean, It's Green, It's the Mystery Machine",7.6,144.0,TV Series,Female,Competition
238,349,The WB,Riva Ras Regas,7.5,125.0,TV Series,Male,Competition
239,350,The WB,Roller Ghoster Ride,7.7,133.0,TV Series,Male,Competition
240,351,The WB,"Safari, So Goodie!",7.1,130.0,TV Series,Male,Smuggling
241,352,The WB,She Sees Sea Monsters by the Sea Shore,7.1,122.0,TV Series,Female,Preservation
242,353,The WB,A Scooby-Doo! Christmas,7.5,137.0,TV Series,Male,Treasure
243,355,The WB,Lights! Camera! Mayhem!,7.5,115.0,TV Series,Male,Competition
244,356,The WB,Pompii and Circumstance,7.1,110.0,TV Series,Male,Competition
245,357,Warner Home Video,Scooby-Doo! and the Legend of the Vampire,6.6,4180.0,Movie,Male,Competition
246,358,The WB,The Unnatural,7.3,110.0,TV Series,Male,Competition
247,359,The WB,Big Appetite in Little Tokyo,7.2,112.0,TV Series,Male,Competition
248,361,The WB,The Fast and the Wormious,7.4,104.0,TV Series,Male,Competition
249,362,Warner Home Video,Scooby-Doo! and the Monster of Mexico,6.5,3462.0,Movie,Male,Competition
250,364,The WB,The Vampire Strikes Back,7.4,105.0,TV Series,Male,Competition
251,365,The WB,A Scooby-Doo Halloween,7.6,129.0,TV Series,Male,Competition
252,366,The WB,Homeward Hound,7.2,97.0,TV Series,Male,Competition
253,367,The WB,The San Franpsycho,7.3,103.0,TV Series,Male,Competition
254,368,The WB,Simple Plan and the Invisible Madman,7.5,113.0,TV Series,Male,Competition
255,369,The WB,Recipe for Disaster,7.5,109.0,TV Series,Male,Competition
256,370,The WB,Large Dragon at Large,7.5,94.0,TV Series,Male,Treasure
257,371,The WB,Uncle Scooby and Antarctica,7.4,99.0,TV Series,Male,Preservation
258,372,The WB,"New Mexico, Old Monster",7.2,96.0,TV Series,Male,Preservation
259,373,Warner Bros. Picture,Scooby-Doo 2: Monsters Unleashed,5.1,50847.0,Movie (Theatrical),Male,Competition
260,374,The WB,It's All Greek to Scooby,7.4,91.0,TV Series,Male,Treasure
261,375,Warner Home Video,Scooby-Doo! and the Loch Ness Monster,6.7,4108.0,Movie,Female,Competition
262,376,The WB,Fright House of a Lighthouse,8.0,128.0,TV Series,Male,Competition
263,377,The WB,"Go West, Young Scoob",7.2,102.0,TV Series,Male,Competition
264,378,Warner Home Video,"Aloha, Scooby-Doo!",6.4,3696.0,Movie,Male,Competition
265,380,The WB,Wrestle Maniacs,7.4,90.0,TV Series,Male,Competition
266,381,The WB,Ready to Scare,7.5,89.0,TV Series,Male,Competition
267,382,The WB,Farmed & Dangerous,7.3,101.0,TV Series,Male,Competition
268,383,The WB,Diamonds Are a Ghoul's Best Friend,7.0,96.0,TV Series,Male,Theft
269,384,The WB,A Terrifying Round with a Menacing Metallic Clown,7.6,105.0,TV Series,Male,Competition
270,385,The WB,Camp Comeoniwannascareya,7.5,100.0,TV Series,Male,Preservation
271,386,The WB,Block-Long Hong Kong Terror,7.4,88.0,TV Series,Male,Competition
272,387,The WB,"Gentlemen, Start Your Monsters!",7.3,87.0,TV Series,Male,Competition
273,388,The WB,Gold Paw,7.4,84.0,TV Series,Male,Competition
274,389,The WB,Reef Grief!,7.5,92.0,TV Series,Male,Competition
275,391,Cartoon Network,E-Scream,7.4,91.0,TV Series,Male,Simulation
276,393,The CW,Shags to Riches,6.1,29.0,TV Series,Male,Theft
277,395,The CW,High Society Scooby,6.0,22.0,TV Series,Male,Conquer
278,396,The CW,Party Arty,5.9,19.0,TV Series,Male,Abduction
279,397,The CW,Smart House,5.9,17.0,TV Series,Male,Conquer
280,398,The CW,Lightning Strikes Twice,5.5,17.0,TV Series,Male,Conquer
281,399,The CW,Don't Feed the Animals,5.8,18.0,TV Series,Male,Treasure
282,400,The CW,Mysterty of the Missing Mystery Solvers,6.9,17.0,TV Series,Male,Abduction
283,401,The CW,Chefs of Steel,5.1,16.0,TV Series,Male,Competition
284,402,The CW,Almost Ghosts,6.1,20.0,TV Series,Male,Theft
285,403,The CW,Pole to Pole,6.1,14.0,TV Series,Male,Conquer
286,404,The CW,Big Trouble,5.9,17.0,TV Series,Male,Conquer
287,406,Cartoon Network,"Chill Out, Scooby-Doo!",6.7,2511.0,Movie,Male,Competition
288,407,The CW,Shaggy and Scooby World,5.3,15.0,TV Series,Male,Conquer
289,408,The CW,Almost Purr-fect,5.2,16.0,TV Series,Male,Theft
290,409,The CW,Inside Job,5.9,18.0,TV Series,Male,Conquer
291,410,The CW,Zoinksman,5.5,14.0,TV Series,Male,Conquer
292,411,The CW,The Many Faces of Evil,5.4,13.0,TV Series,Male,Conquer
293,412,The CW,Crusin' for a Brusin',5.6,11.0,TV Series,Male,Conquer
294,413,The CW,There's a Doctor in the House,5.5,11.0,TV Series,Male,Conquer
295,414,The CW,Super Scary Movie Night,5.4,11.0,TV Series,Male,Conquer
296,415,The CW,Runaway Robi,4.8,9.0,TV Series,Male,Conquer
297,416,The CW,Don't Get a Big Head,4.6,9.0,TV Series,Male,Conquer
298,417,The CW,Scooby Dudes,6.2,13.0,TV Series,Male,Conquer
299,418,The CW,Zoinks the Wonder Dog,5.1,9.0,TV Series,Male,Conquer
300,419,The CW,Uncle Albert Alert,5.8,9.0,TV Series,Male,Conquer
301,420,Warner Home Video,Scooby-Doo! and the Goblin King,6.4,2285.0,Movie,Male,Conquer
302,421,Warner Home Video,Scooby-Doo! and the Samurai Sword,6.5,2182.0,Movie,Male,Conquer
303,424,Cartoon Network,Beware the Beast From Below,7.9,337.0,TV Series,Male,Theft
304,426,Cartoon Network,The Secret of the Ghost Rig,7.7,267.0,TV Series,Male,Theft
305,427,Cartoon Network,Revenge of the Man Crab,7.7,255.0,TV Series,Male,Competition
306,428,Cartoon Network,The Song of Mystery,8.0,254.0,TV Series,Male,Competition
307,429,Cartoon Network,The Legend of Alice May,8.5,263.0,TV Series,Female,Competition
308,430,Cartoon Network,In Fear of the Phantom,8.2,256.0,TV Series,Male,Competition
309,431,Cartoon Network,The Grasp of the Gnome,7.8,229.0,TV Series,Male,Competition
310,432,Cartoon Network,Battle of the Humungonauts,7.6,221.0,TV Series,Male,Competition
311,434,Cartoon Network,Howl of the Fright Hound,8.2,235.0,TV Series,Male,Competition
312,435,Cartoon Network,The Secret Serum,8.1,225.0,TV Series,Female,Theft
313,436,Cartoon Network,The Shrieking Madness,8.4,246.0,TV Series,Male,Competition
314,437,Cartoon Network,When the Cicada Calls,8.0,224.0,TV Series,Male,Preservation
315,439,Cartoon Network,Mystery Solvers Club State Finals,8.2,254.0,TV Series,Male,Imagination
316,440,Cartoon Network,The Wild Brood,7.7,221.0,TV Series,Male,Competition
317,441,Cartoon Network,Where Walks Aphrodite,8.2,228.0,TV Series,Female,Competition
318,442,Cartoon Network,Escape from Mystery Manor,8.8,250.0,TV Series,Male,Preservation
319,443,Cartoon Network,The Dragon's Secret,8.2,211.0,TV Series,Male,Theft
320,444,Cartoon Network,Nightfright,8.5,227.0,TV Series,Male,Competition
321,445,Cartoon Network,The Siren's Song,8.1,203.0,TV Series,Male,Natural Resource
322,446,Cartoon Network,Menace of the Manticore,8.2,212.0,TV Series,Male,Competition
323,447,Cartoon Network,Attack of the Headless Horror,8.1,196.0,TV Series,Male,Competition
324,448,Cartoon Network,A Haunting in Crystal Cove,8.6,211.0,TV Series,Male,Theft
325,449,Cartoon Network,Dead Justice,8.2,194.0,TV Series,Male,Competition
326,450,Cartoon Network,Pawn of Shadows,8.8,212.0,TV Series,Female,Theft
327,451,Cartoon Network,All Fear the Freak,9.2,272.0,TV Series,Male,Theft
328,452,Warner Home Video,Scooby-Doo! Legend of the Phantosaur,6.8,1899.0,Movie,Male,Natural Resource
329,453,Warner Home Video,Scooby-Doo! Music of the Vampire,6.5,1573.0,Movie,Male,Competition
330,454,Warner Home Video,Scooby-Doo! Spooky Games,6.9,195.0,TV Series,Male,Competition
332,457,Cartoon Network,The Night the Clown Cried II - Tears of Doom,8.4,197.0,TV Series,Male,Abduction
333,458,Cartoon Network,Web of the Dreamweaver!,8.2,192.0,TV Series,Male,Competition
334,459,Cartoon Network,The Hodag of Horror,8.4,188.0,TV Series,Male,Theft
335,460,Cartoon Network,Art of Darkness,7.7,177.0,TV Series,Male,Competition
336,461,Cartoon Network,The Gathering Gloom,8.2,172.0,TV Series,Male,Natural Resource
337,462,Cartoon Network,Night on Haunted Mountain,8.3,183.0,TV Series,Female,Treasure
338,463,Cartoon Network,Grrim Judgment,8.3,176.0,TV Series,Male,Competition
339,464,Cartoon Network,Night Terrors,9.1,202.0,TV Series,Male,Competition
340,466,Cartoon Network,Scarebear,8.2,169.0,TV Series,Male,Preservation
341,467,Cartoon Network,Wrath of the Krampus,8.9,207.0,TV Series,Male,Theft
342,468,Cartoon Network,Heart of Evil,7.6,174.0,TV Series,Male,Theft
343,469,Cartoon Network,Theater of Doom,8.6,180.0,TV Series,Male,Theft
344,470,Warner Home Video,Big Top Scooby-Doo!,6.9,1442.0,Movie,Male,Theft
345,471,Warner Home Video,Scooby-Doo! Haunted Holidays,7.0,392.0,TV Series,Male,Competition
346,472,Warner Home Video,Scooby-Doo! Mask of the Blue Falcon,6.8,1485.0,Movie,Male,Competition
347,475,Cartoon Network,Dance of the Undead,8.0,180.0,TV Series,Male,Competition
348,476,Cartoon Network,The Devouring,7.8,166.0,TV Series,Male,Competition
349,477,Cartoon Network,Stand and Deliver,8.3,171.0,TV Series,Male,Competition
350,479,Cartoon Network,Nightmare in Red,8.9,187.0,TV Series,Male,Preservation
